{
  "schema_version": 1,
  "sku": "FIG-PETBIG-TUX-80",
  "name": "Me & My Big Pet: custom figurine (tuxedo cat sample)",
  "family": "figure-with-pet",
  "status": "preflight-pass",
  "parents": ["TPL-FIG-PETBIG"],
  "geometry": {
    "source": {"generator": "meshy", "file": "files/uploads/Meshy_AI_me_and_my_big_pet_fig_1010081949_image-to-3d-texture.glb", "template": "Meshy 'me and my big pet' image-to-3D"},
    "units": "mm",
    "height_mm": 80,
    "size_variants_mm": [60, 80, 100],
    "dims_mm": [61.74, 58.76, 79.99],
    "faces": 149822,
    "volume_cm3": 71.4,
    "locked_features": [
      {"id": "base_disc", "kind": "plinth", "note": "round black base ~58 mm, flat underside = stability; never cut or text-engrave its underside"},
      {"id": "scale_ratio", "kind": "composition", "note": "pet oversized (~1.8x person). The joke of the product; keep it"}
    ]
  },
  "manufacture": {
    "supplier": "jlc3dp",
    "process": "wjp",
    "material": "Full Color Resin",
    "finish": "Oil Spraying (clear gloss, included)",
    "file_format": "obj-mtl-png-zip",
    "jlc_settings": {"process": "WJP(Resin)", "material": "Full Color Resin", "colour": "Multicolor (check MTL tag)", "qty": 1, "thin_wall_risk_box": "tick", "packaging": "Blank Box"},
    "preflight": {"verdict": "PASS_WITH_WARNINGS", "report": "work/bigpet/h80/preflight.json", "run_at": "2026-10-10T09:10Z",
      "warnings": ["zip 8.5 MB (above the 6-7 MB proven size, below the 14-16 MB that failed)", "thin faces < 0.8 mm flagged on ears/tail/hair edges (JLC flags every figure)", "122 self-intersecting faces where person touches cat; WJP fuses them"]},
    "cost": {"currency": "USD", "print_estimate": 58.58, "print_quoted": null, "shipping_estimate": 7.0, "basis": "solid 71.4 cm3 x ~$0.82/cm3 from the 2026-10-09 brick-figure quotes; get a real JLC quote"},
    "lead_time_days": {"build": 5, "ship_min": 8, "ship_max": 13}
  },
  "slots": [
    {"id": "subject", "type": "mesh", "label": "You + your pet", "required": true,
     "surface": {"kind": "whole-model"}, "method": "subject-mesh",
     "mesh": {"subject_kind": "person+pet", "input": "1 photo of the person (full body) + 1-3 photos of the pet", "generator": "meshy image-to-3d (template: me and my big pet)", "cached_per": "order", "regen_cost_usd": null},
     "preview": "mesh-render"},
    {"id": "pet_name", "type": "text", "label": "Pet's name on the base rim", "required": false,
     "surface": {"kind": "uv-curved", "anchor": "base_disc.front_rim", "box_mm": [40, 4]}, "method": "texture-paint",
     "text": {"font": "Fraunces", "cap_mm": 3.0, "min_cap_mm": 2.0, "max_chars": 14, "min_chars": 1, "lines": 1, "charset": "A-Z a-z 0-9 '&-.", "relief_mm": 0, "fit": "shrink-then-fallback-then-error"},
     "profile_source": ["pet_name"], "fallback_source": ["pet_initial"], "preview": "plate-uv",
     "ext": {"validated": false, "note": "proposed; bounds not yet measured on the real base"}},
    {"id": "base_colour", "type": "colour", "label": "Base colour", "required": false,
     "surface": {"kind": "material", "anchor": "base_disc"}, "method": "texture-paint",
     "colour": {"palette": ["#111111 gloss black", "#F4F1EA bone", "#1F3A5F navy", "#EE7410 OddHobb orange"], "default": "#111111 gloss black"},
     "preview": "plate-uv", "ext": {"validated": false}}
  ],
  "audience": {
    "suits": ["cat or dog owners who joke their pet runs the house", "people who post their pet more than themselves", "new pet parents", "someone who just lost a pet (memorial version, softer copy)"],
    "occasions": ["birthday", "Christmas", "gotcha day", "pet memorial", "moving in together", "Mother's/Father's Day from the pet"],
    "interests": ["pets", "cute collectibles", "desk decor"],
    "relationship_to_buyer": ["partner", "sister/brother", "best friend", "mum/dad", "self-gift"],
    "not_for": ["buyers wanting photoreal portrait likeness (it's stylised)", "kids under 3 (small parts, resin)", "outdoor display (UV fade)"],
    "price_band": "premium £40-90",
    "tone": ["cute", "funny-affectionate"]
  },
  "listing": {
    "title": "Custom Pet & Owner Figurine, Me and My Big Pet, Personalised Full Colour 3D Printed Cat or Dog Statue from Photo, Pet Lover Gift",
    "price": {"currency": "GBP", "amount": null, "by_size": {"60": null, "80": null, "100": null}},
    "tags": ["custom pet figurine", "pet and owner gift", "cat statue custom", "dog figurine photo", "pet portrait 3d", "personalised pet", "cat mum gift", "dog dad gift", "pet memorial gift", "3d printed figure", "custom cat figure", "gift for pet lover", "mini me figurine"],
    "short": "You, tiny. Your pet, enormous. Hand-finished full-colour 3D figurine made from your photos.",
    "description": "Send us a photo of you and your pet and we sculpt you both: you at normal size, your pet as the giant they think they are. Printed in full-colour resin with a clear gloss coat, on a round display base.",
    "spec_rows": [["Height", "80 mm (60/100 mm options)"], ["Base", "58 mm round"], ["Material", "Full-colour resin, gloss coat"], ["Made from", "Your photos (1 of you, 1-3 of your pet)"], ["Production", "about 5 days + shipping"]],
    "channels": ["etsy", "oddhobb-store"]
  },
  "assets": {
    "master": "files/uploads/Meshy_AI_me_and_my_big_pet_fig_1010081949_image-to-3d-texture.glb",
    "print_pack": "work/bigpet/h80/bigpet-80-jlc.zip",
    "renders": {"hero": "work/bigpet/h80/listing/bigpet_hero.png", "front": "work/bigpet/h80/listing/bigpet_front.png", "side": "work/bigpet/h80/listing/bigpet_side.png", "back": "work/bigpet/h80/listing/bigpet_back.png", "detail": "work/bigpet/h80/listing/bigpet_detail.png"},
    "plates": []
  },
  "graph": {"variant_of": "TPL-FIG-PETBIG", "pairs_with": ["CARD-FORMAT1"], "upsell_to": ["FIG-PETBIG-*-100"], "composes": []},
  "ext": {}
}
